<?xml version="1.0" encoding="UTF-8"?>
<configuration xmlns:xsi="http://www.w3.org/2001/XMLSchema-instance" xsi:noNamespaceSchemaLocation="ModelConfig.xsd">
	<elements>
		<default type="fake.package.model.Default"/>
		<drift type="fake.package.model.Drift"/>
	</elements>
	<hardware>
		<thin type="fake.package.Thin1"/>
		<thin type="fake.package.Thin2"/>
		<thick type="fake.package.Thick1"/>
		<thick type="fake.package.Thick2"/>
		<split/>
	</hardware>
	<associations>
		<map smf="fake.package.Map1" model="fake.package.model.Map1"/>
		<map smf="fake.package.Map2" model="fake.package.model.Map2">
			<static>
				<property name="test" value="1"/>
			</static>
		</map>
		<map smf="fake.package.Map3" model="fake.package.model.Map3">
			<synchronize mode="INIT">
				<parameter name="A" hget="getField" mset="setMagField" type="java.lang.double"/>
				<parameter name="B" hget="getField" mset="setMagField" type="java.lang.double"/>
			</synchronize>
			<synchronize mode="LIVE">
				<parameter name="A" hget="getField" mset="setMagField" type="java.lang.double"/>
				<parameter name="B" hget="getField" mset="setMagField" type="java.lang.double"/>
			</synchronize>
		</map>
	</associations>
</configuration>
